pmcid	doi	abstractText	pubYear	title	pmid	secondary_symbol	primary_symbol	type
PMC8006465	10.3389/fnagi.2021.639428	Alzheimer's disease (AD) is characterized by specific alterations of brain DNA methylation (DNAm) patterns. Age and sex, two major risk factors for AD, are also known to largely affect the epigenetic profiles in brain, but their contribution to AD-associated DNAm changes has been poorly investigated. In this study we considered publicly available DNAm datasets of four brain regions (temporal, frontal, entorhinal cortex, and cerebellum) from healthy adult subjects and AD patients, and performed a meta-analysis to identify sex-, age-, and AD-associated epigenetic profiles. In one of these datasets it was also possible to distinguish 5-methylcytosine (5mC) and 5-hydroxymethylcytosine (5hmC) profiles. We showed that DNAm differences between males and females tend to be shared between the four brain regions, while aging differently affects cortical regions compared to cerebellum. We found that the proportion of sex-dependent probes whose methylation is modified also during aging is higher than expected, but that differences between males and females tend to be maintained, with only a few probes showing age-by-sex interaction. We did not find significant overlaps between AD- and sex-associated probes, nor disease-by-sex interaction effects. On the contrary, we found that AD-related epigenetic modifications are significantly enriched in probes whose DNAm varies with age and that there is a high concordance between the direction of changes (hyper or hypo-methylation) in aging and AD, supporting accelerated epigenetic aging in the disease. In summary, our results suggest that age-associated DNAm patterns concur to the epigenetic deregulation observed in AD, providing new insights on how advanced age enables neurodegeneration.	2021	A Meta-Analysis of Brain DNA Methylation Across Sex, Age, and Alzheimer's Disease Points for Accelerated Epigenetic Aging in Neurodegeneration.	33790779	NCRNA00181	A1BG-AS1	secondary_symbol
PMC4640166	10.1186/s12864-015-2034-y	<h4>Background</h4>DNA methylation is an important epigenetic mark that can potentially link early life exposures to adverse health outcomes later in life. Host factors like sex and age strongly influence biological variation of DNA methylation, but characterization of these relationships is still limited, particularly in young children.<h4>Methods</h4>In a sample of 111 Mexican-American subjects (58 girls , 53 boys), we interrogated DNA methylation differences by sex at birth using the 450 K BeadChip in umbilical cord blood specimens, adjusting for cell composition.<h4>Results</h4>We observed that ~3% of CpG sites were differentially methylated between girls and boys at birth (FDR P < 0.05). Of those CpGs, 3031 were located on autosomes, and 82.8% of those were hypermethylated in girls compared to boys. Beyond individual CpGs, we found 3604 sex-associated differentially methylated regions (DMRs) where the majority (75.8%) had higher methylation in girls. Using pathway analysis, we found that sex-associated autosomal CpGs were significantly enriched for gene ontology terms related to nervous system development and behavior. Among hits in our study, 35.9% had been previously reported as sex-associated CpG sites in other published human studies. Further, for replicated hits, the direction of the association with methylation was highly concordant (98.5-100%) with previous studies.<h4>Conclusions</h4>To our knowledge, this is the first reported epigenome-wide analysis by sex at birth that examined DMRs and adjusted for confounding by cell composition. We confirmed previously reported trends that methylation profiles are sex-specific even in autosomal genes, and also identified novel sex-associated CpGs in our methylome-wide analysis immediately after birth, a critical yet relatively unstudied developmental window.	2015	Sex differences in DNA methylation assessed by 450 K BeadChip in newborns.	26553366	NCRNA00181	A1BG-AS1	secondary_symbol
NA	10.1002/lary.30840	<h4>Objective</h4>Biological data on the beneficial effects of vocal fold rehydration are lacking. This study aimed to examine the effects of acute systemic dehydration on vocal fold gene expression and determine whether rehydration would reverse these changes.<h4>Methods</h4>Male New Zealand White rabbits (N = 24, n = 8/group) provided the animal model. Systemic dehydration was induced by 5 days of water volume restriction. Rehydration was provided by ad-lib water for 3 days following dehydration. Euhydrated rabbits were used as the control group. Vocal fold tissue was dissected. Seventeen genes were selected based on physiological function and role in supporting vocal fold structure, oxidative stress, hemodynamics, and extracellular matrix turnover. Relative gene expression was assessed by RT-qPCR.<h4>Results</h4>Rehydration following systemic dehydration can modulate gene expression, with expression patterns suggesting that rehydration reverses dehydration-induced changes in over half of the tested genes. CLIC5 (chloride intracellular channel 5) and EFEMP1 (EGF containing fibulin extracellular matrix protein 1) genes were significantly upregulated in the dehydration group compared with the euhydrated control. A1BG (alpha-1B-glycoprotein) and IL1RAP (interleukin 1 receptor accessory protein) were downregulated by rehydration compared with the dehydration group.<h4>Conclusion</h4>This study provides molecular evidence for a transcriptional response to rehydration following acute systemic dehydration in the vocal folds. These data are the first to study gene expression following realistic dehydration and rehydration paradigms and provide biological data to support clinical recommendations to increase water intake after acute dehydration.<h4>Level of evidence</h4>N/A Laryngoscope, 2023.	2023	Impact of Rehydration Following Systemic Dehydration on Vocal Fold Gene Expression.	37345579	A1BG-AS	A1BG-AS1	secondary_symbol
PMC10093134	10.3390/diagnostics13071318	Nowadays, in the case of suspected prostate cancer (PCa), tissue needle biopsy remains the benchmark for diagnosis despite its invasiveness and poor tolerability, as serum prostate-specific antigen (PSA) is limited by low specificity. The aim of this proteomic study was to identify new diagnostic biomarkers in urine, an easily and non-invasively available sample, able to selectively discriminate cancer from benign prostatic hyperplasia (BPH), evaluating whether the presence of inflammation may be a confounding parameter. The analysis was performed by two-dimensional gel electrophoresis (2-DE), mass spectrometry (LC-MS/MS) and Enzyme-Linked Immunosorbent Assay (ELISA) on urine samples from PCa and BPH patients, divided into subgroups based on the presence or absence of inflammation. Significant quantitative and qualitative differences were found in the urinary proteomic profile of PCa and BPH groups. Of the nine differentially expressed proteins, only five can properly be considered potential biomarkers of PCa able to discriminate the two diseases, as they were not affected by the inflammatory process. Therefore, the proteomic research of novel and reliable urinary biomarkers of PCa should be conducted considering the presence of inflammation as a realistic interfering element, as it could hinder the detection of important protein targets.	2023	Research of Prostate Cancer Urinary Diagnostic Biomarkers by Proteomics: The Noteworthy Influence of Inflammation.	37046536	A1BG-AS	A1BG-AS1	secondary_symbol
PMC9977555	10.1155/2023/6072438	<h4>Introduction</h4>Diabetes is a chronic inflammatory state, and a key role of lncRNAs in diabetes complications is a new area of research.<h4>Methods</h4>In this study, key lncRNAs related to diabetes inflammation were identified by RNA-chip mining and lncRNA-mRNA coexpression network construction and finally verified by RT-qPCR.<h4>Results</h4>We ultimately obtained 12 genes, including A1BG-AS1, AC084125.4, RAMP2-AS1, FTX, DBH-AS1, LOXL1-AS1, LINC00893, LINC00894, PVT1, RUSC1-AS1, HCG25, and ATP1B3-AS1. RT-qPCR assays verified that LOXL1-AS1, A1BG-AS1, FTX, PVT1, and HCG25 were upregulated in the HG+LPS-induced THP-1 cells, and LINC00893, LINC00894, RUSC1-AS1, DBH-AS1, and RAMP2-AS1 were downregulated in the HG+LPS-induced THP-1 cells.<h4>Conclusions</h4>lncRNAs and mRNAs are extensively linked and form a coexpression network, and lncRNAs may influence the development of type 2 diabetes by regulating the corresponding mRNAs. The ten key genes obtained may become biomarkers of inflammation in type 2 diabetes in the future.	2023	Bioinformatics Analysis of the Inflammation-Associated lncRNA-mRNA Coexpression Network in Type 2 Diabetes.	36874406	A1BG-AS	A1BG-AS1	secondary_symbol
PMC10007776	10.1186/s13098-023-01007-y	<h4>Background</h4>Subclinical atherosclerosis is frequently observed in type 1 diabetes (T1D) although the mechanisms and markers involved in the evolution to established cardiovascular disease are not well known. High-density lipoprotein cholesterol in T1D is normal or even high, and changes in its functionality and proteomics are considered. Our aim was to evaluate the proteomics of HDL subfractions in T1D and control subjects and its association with clinical variables, subclinical atherosclerosis markers and HDL functionality.<h4>Methods</h4>A total of 50 individuals with T1D and 30 matched controls were included. Carotid-femoral pulse wave velocity (PWV), flow-mediated vasodilation (FMD), cardiovascular autonomic neuropathy (CAN), and ten-year cardiovascular risk (ASCVDR) were determined. Proteomics (parallel reaction monitoring) was determined in isolated HDL<sub>2</sub> and HDL<sub>3</sub> that were also utilized to measure cholesterol efflux from macrophages.<h4>Results</h4>Among 45 quantified proteins, 13 in HDL<sub>2</sub> and 33 in HDL<sub>3</sub> were differentially expressed in T1D and control subjects. Six proteins related to lipid metabolism, one to inflammatory acute phase, one to complement system and one to antioxidant response were more abundant in HDL<sub>2</sub>, while 14 lipid metabolism, three acute-phase, three antioxidants and one transport in HDL<sub>3</sub> of T1D subjects. Three proteins (lipid metabolism, transport, and unknown function) were more abundant in HDL<sub>2</sub>; and ten (lipid metabolism, transport, protease inhibition), more abundant in HDL<sub>3</sub> of controls. Individuals with T1D had higher PWV and ten-year ASCVDR, and lower FMD, Cholesterol efflux from macrophages was similar between T1D and controls. Proteins in HDL<sub>2</sub> and HDL<sub>3</sub>, especially related to lipid metabolism, correlated with PWV, CAN, cholesterol efflux, HDLc, hypertension, glycemic control, ten-year ASCVDR, and statins use.<h4>Conclusion</h4>HDL proteomics can be predictive of subclinical atherosclerosis in type 1 diabetes. Proteins that are not involved in reverse cholesterol transport may be associated with the protective role of HDL.	2023	Proteomics of high-density lipoprotein subfractions and subclinical atherosclerosis in type 1 diabetes mellitus: a case-control study.	36899434	A1BG-AS	A1BG-AS1	secondary_symbol
PMC10117404	10.1158/2767-9764.crc-23-0015	The response rates upon neoadjuvant immune checkpoint blockade (ICB) in stage III melanoma are higher as compared with stage IV disease. Given that successful ICB depends on systemic immune response, we hypothesized that systemic immune suppression might be a mechanism responsible for lower response rates in late-stage disease, and also potentially with disease recurrence in early-stage disease. Plasma and serum samples of cohorts of patients with melanoma were analyzed for circulating proteins using mass spectrometry proteomic profiling and Olink proteomic assay. A cohort of paired samples of patients with stage III that progressed to stage IV disease (<i>n</i> = 64) was used to identify markers associated with higher tumor burden. Baseline patient samples from the OpACIN-neo study (<i>n</i> = 83) and PRADO study (<i>n</i> = 49; NCT02977052) were used as two independent cohorts to analyze whether the potential identified markers are also associated with disease recurrence after neoadjuvant ICB therapy. When comparing baseline proteins overlapping between patients with progressive disease and patients with recurrent disease, we found leucine-rich alpha-2-glycoprotein 1 (LRG1) to be associated with worse prognosis. Especially nonresponder patients to neoadjuvant ICB (OpACIN-neo) with high LRG1 expression had a poor outcome with an estimated 36-month event-free survival of 14% as compared with 83% for nonresponders with a low LRG1 expression (<i>P</i> = 0.014). This finding was validated in an independent cohort (<i>P</i> = 0.0021). LRG1 can be used as a biomarker to identify patients with high risk for disease progression and recurrence, and might be a target to be combined with neoadjuvant ICB.<h4>Significance</h4>LRG1 could serve as a potential target and as a biomarker to identify patients with high risk for disease recurrence, and consequently benefit from additional therapies and intensive follow-up.	2023	Systemic LRG1 Expression in Melanoma is Associated with Disease Progression and Recurrence.	37089863	A1BG-AS	A1BG-AS1	secondary_symbol
PMC10008006	10.2147/dmso.s396239	<h4>Purpose</h4>Obesity is considered a promoter of type 2 diabetes mellitus (T2DM). However, the underlying mechanism remains unclear. This study aimed to identify plasma exosome differentially expressed proteins (DEPs) that are potentially involved in the development of obesity-related T2DM.<h4>Methods</h4>Exosomes were isolated from the plasma of obese and non-obese T2DM patients (n = 10 for each group). A label-free quantitative mass spectrometry analysis was applied to identify plasma exosome DEPs in obese patients compared with non-obese patients, followed by bioinformatics analysis including GO annotation, KEGG analysis, subcellular localization prediction, transcription factor analysis, and protein-protein interaction (PPI) prediction.<h4>Results</h4>We identified 2 significantly upregulated proteins (C9 and PON1) and 5 significantly downregulated proteins (HPX, A1BG, CFHR1, ANG, and CALM) in obese patients compared with those in non-obese patients. KEGG analysis demonstrated that the insulin signaling pathway was one of the pathways that significantly correlated with the DEPs. The DEPs were primarily localized in the extracellular space (5 out of 7). HMG-box and NF-Y beta might regulate the transcription of the DEPs. C9, PON1, HPX, and CFHR1 were present in the PPI network.<h4>Conclusion</h4>The plasma exosome DEPs are potentially responsible for the development of obesity-related T2DM possibly through the insulin signaling pathway and the interaction with other proteins. Our study may guide future research direction toward the pathogenesis of obesity-related T2DM.	2023	Comparison of Plasma Exosome Proteomes Between Obese and Non-Obese Patients with Type 2 Diabetes Mellitus.	36915396	A1BG-AS	A1BG-AS1	secondary_symbol
NA	10.21203/rs.3.rs-1928440/v1	<h4>Background: </h4> The present study mined key lncRNAs and their functions related to inflammation in type 2 diabetes by constructing a lncRNA-mRNA co-expression network based on bioinformatics technology to discover new markers or therapeutic targets. Results  We finally obtained 12 genes, including A1BG-AS1, AC084125.4, RAMP2-AS1, FTX, DBH-AS1, LOXL1-AS1, LINC00893, LINC00894, PVT1, RUSC1-AS1, HCG25, and ATP1B3-AS1. RT-qPCR verified that A1BG-AS1, HCG25, and LOXL1-AS1 were upregulated in the HG + LPS-induced THP-1 cell model, and DBH-AS1 was downregulated in the HG + LPS-induced THP-1 cell model. Conclusions  LncRNAs and mRNAs are extensively linked and form a co-expression network, and lncRNAs may influence the development of type 2 diabetes by regulating the corresponding mRNAs. The four key genes obtained may become biomarkers of inflammation in type 2 diabetes in the future.	2022	Bioinformatics analysis of the inflammation-associated lncRNA- mRNA co-expression network in type 2 diabetes	NA	A1BG-AS	A1BG-AS1	secondary_symbol
PMC9924781	10.19852/j.cnki.jtcm.20220617.002	<h4>Objective</h4>To explore the novel biomarkers and therapeutic target candidates related to the stasis-heat syndrome of acute intracerebral hemorrhage (AICH).<h4>Methods</h4>Applying an isobaric tagging for relative and absolute quantitation-(iTRAQ-) based quantitative proteomic approach, plasma samples from AICH patients with stasis-heat, and AICH patients with non-stasis-heat and healthy control subjects were collected and analyzed to distinguish differentially expressed proteins (DEPs) correlated to AICH with stasis-heat in this block design. The standard Western blot was applied to verify DEPs. Additionally, DEPs were analyzed via bioinformatic platforms and further approved via Ingenuity Pathway Analysis (IPA).<h4>Results</h4>A total of 26 DEPs were found among AICH with the stasis-heat, AICH with non-stasis-heat, and healthy control group. The seven DEPs compared with the non-stasis-heat group are closely related to the pathogenesis of stasis heat. These proteins showed three different protein expression patterns. The alpha-1-b glycoprotein (A1BG) and copper-protein (CP) were up-regulated in the stasis-heat group, but down-regulated in the non-stasis-heat group. Compared with the non-stasis-heat group, the expression abundance of actinin, alpha 1 (ACTN1), carbonic anhydrase I (CA1), peroxiredoxin 2 (PRDX2), and vinculin (VCL) is higher in the stasis-heat group, while the CD44 is the opposite. These differences reflect that stasis-heat syndrome has more severe inflammatory immune response, coagulation disorders and damage. Bioinformatics analysis revealed that a wide variety of cellular and metabolic processes and some signaling pathways were involved in the pathophysiology of AICH with stasis-heat. AICH with stasis-heat syndrome showed more severe inflammatory reactions, tissue damage, and coagulation disorders than non-stasis heat syndrome.<h4>Conclusions</h4>There are differences in the protein expression patterns between the stasis-heat syndrome and non-stasis-heat syndrome. These differences reflect that stasis-heat syndrome has more severe damage. CD44, CP, ACTN1, CA1, VCL, PRDX2, and A1BG could be the potential biomarkers and therapeutic target candidates of the stasis-heat subtype. This study provides a reasonable explaination for Liangxue Tongyu decoction through anti-inflammatory and brain protection treatment.	2022	Identification of novel biomarkers and therapeutic target candidates for stasis-heat symptom pattern of acute intracerebral hemorrhage by quantitative plasma proteomics.	35848980	A1BG-AS	A1BG-AS1	secondary_symbol
PMC9954087	10.3390/cancers15041335	Oncology research has received considerable attention in recent years due to the increasing prevalence of cancer in human and animal populations worldwide [...].	2023	Translational and Comparative Research on Innovative Anti-Cancer Therapies.	36831676	A1BG-AS	A1BG-AS1	secondary_symbol
PMC9162367	10.1371/journal.pone.0267744	Immunoglobulin superfamily, member 1 (IGSF1) is a transmembrane glycoprotein with high expression in the mammalian pituitary gland. Mutations in the IGSF1 gene cause congenital central hypothyroidism in humans. The IGSF1 protein is co-translationally cleaved into N- and C-terminal domains (NTD and CTD), the latter of which is trafficked to the plasma membrane and appears to be the functional portion of the molecule. Though the IGSF1-NTD is retained in the endoplasmic reticulum and has no apparent function, it has a high degree of sequence identity with the IGSF1-CTD and is conserved across mammalian species. Based upon phylogenetic analyses, we propose that the ancestral IGSF1 gene encoded the IGSF1-CTD, which was duplicated and integrated immediately upstream of itself, yielding a larger protein encompassing the IGSF1-NTD and IGSF1-CTD. The selective pressures favoring the initial gene duplication and subsequent retention of a conserved IGSF1-NTD are unresolved.	2022	The extant immunoglobulin superfamily, member 1 gene results from an ancestral gene duplication in eutherian mammals.	35653309	A1BG-AS	A1BG-AS1	secondary_symbol
NA	10.3390/cells12121601	The development of new approaches allowing for the early assessment of COVID-19 cases that are likely to become critical and the discovery of new therapeutic targets are urgently required. In this prospective cohort study, we performed proteomic and laboratory profiling of plasma from 163 COVID-19 patients admitted to Bauru State Hospital (Brazil) between 4 May 2020 and 4 July 2020. Plasma samples were collected upon admission for routine laboratory analyses and shotgun quantitative label-free proteomics. Based on the course of the disease, the patients were divided into three groups: (a) mild (<i>n</i> = 76) and (b) severe (<i>n</i> = 56) symptoms, whose patients were discharged without or with admission to an intensive care unit (ICU), respectively, and (c) critical (<i>n</i> = 31), a group consisting of patients who died after admission to an ICU. Based on our data, potential therapies for COVID-19 should target proteins involved in inflammation, the immune response and complement system, and blood coagulation. Other proteins that could potentially be employed in therapies against COVID-19 but that so far have not been associated with the disease are CD5L, VDBP, A1BG, C4BPA, PGLYRP2, SERPINC1, and APOH. Targeting these proteins' pathways might constitute potential new therapies or biomarkers of prognosis of the disease.	2023	Analysis of Plasma Proteins Involved in Inflammation, Immune Response/Complement System, and Blood Coagulation upon Admission of COVID-19 Patients to Hospital May Help to Predict the Prognosis of the Disease.	37371071	A1BG-AS	A1BG-AS1	secondary_symbol
PMC9301696	10.1021/acsomega.2c00837	This study aimed to identify secreted protein biomarkers in serum from the label-free LC/MS proteomics of neutrophils in pulmonary tuberculosis (TB) patients for the diagnosis biomarkers of TB label-free LC/MS. The proteomic profiles of neutrophils from 15 active TB patients and 15 healthy controls (HCs) were analyzed using label-free LC/MS. We identified 358 differentially expressed proteins preliminarily, including 279 up-regulated proteins and 79 down-regulated proteins. Thirty-eight differentially expressed secreted proteins involved in the progress of platelet degranulation between TB patients and HCs were focused. Of these, serotransferrin (TRF), alpha-2-macroglobulin (AMG), alpha-1-antitrypsin (AAT), alpha-1-acid glycoprotein 1 (AAG), alpha-1-acid glycoprotein 2 (AGP2), and alpha-1B-glycoprotein (A1BG) were selected for further verification in the serum of additional 134 TB patients and 138 HCs by nephelometry and ELISA in the training set. Statistically significant differences of TRF (<i>P</i> < 0.0001), AAT (<i>P</i> < 0.0001), AAG (<i>P</i> < 0.0001), AGP2 (<i>P</i> < 0.0001), and A1BG (<i>P</i> = 0.0003) were observed. The serum concentration of TRF was down-regulated in TB patients compared with healthy controls, which was coincident with the proteomics results. An additional validation of TRF was performed in an independent cohort of patients with active TB (<i>n</i> = 46), patients with lung cancer (<i>n</i> = 37), 20 HCs, and patients with pneumonia (<i>n</i> = 35) in the test set by nephelometry. The serum expression levels of TRF in the TB patients showed lower levels compared with those in patients with pneumonia (<i>P</i> = 0.0125), lung cancer (<i>P</i> = 0.0005), HCs (<i>P</i> < 0.0001), and the non-TB controls (<i>P</i> < 0.0001). Furthermore, the AUC value of TRF was 0.647 with 90.22% sensitivity and 42.86% specificity in discriminating the TB group from the pneumonia group, 0.702 with 93.48% sensitivity and 47.16% specificity in discriminating the TB group from the lung cancer group, 0.894 with 91.30% sensitivity and 71.62% specificity in discriminating the TB group from all HCs, and 0.792 with 91.30% sensitivity and 58.90% specificity in discriminating the TB group from the non-TB controls. This study obtained the proteomic profiles of neutrophils in the TB patients and HCs, which contribute to a better understanding of the pathogenesis molecules existing in the neutrophils of pulmonary tuberculosis and provide candidate biomarkers for the diagnosis of pulmonary tuberculosis.	2022	Validation of Serotransferrin in the Serum as Candidate Biomarkers for the Diagnosis of Pulmonary Tuberculosis by Label-Free LC/MS.	35874208	A1BG-AS	A1BG-AS1	secondary_symbol
